{
    "patient_id": "0X3FF3AADBE6D35A09",
    "prediction": {
        "base_score": 0.5108196139335632,
        "class": 2,
        "class_label": "Severe",
        "softmax": [
            0.2236674278974533,
            0.2655129134654999,
            0.5108196139335632
        ]
    },
    "echo": {
        "predicted_ef": 29.983152389526367,
        "ground_truth_ef": 16.8411152
    },
    "ecg": {
        "representation": "512-dimensional embedding",
        "top_embedding_dimension": 497,
        "importance": 3.963246344240615
    },
    "explainability": {
        "gradcam_ed": "/home/vasanth/projects/cardiac_vr_project/outputs/heatmaps/0X3FF3AADBE6D35A09_ed.png",
        "gradcam_es": "/home/vasanth/projects/cardiac_vr_project/outputs/heatmaps/0X3FF3AADBE6D35A09_es.png"
    },
    "metadata": {
        "fusion_type": "Late Fusion",
        "echo_dataset": "EchoNet-Dynamic",
        "ecg_dataset": "PTB-XL / MIT-BIH",
        "intern": "Intern 2"
    }
}