{
    "patient_id": "0X482BB41895F1974D",
    "prediction": {
        "base_score": 0.48969221115112305,
        "class": 0,
        "class_label": "Normal",
        "softmax": [
            0.48969221115112305,
            0.2840385138988495,
            0.22626926004886627
        ]
    },
    "echo": {
        "predicted_ef": 57.71312713623047,
        "ground_truth_ef": 54.76400464
    },
    "ecg": {
        "representation": "512-dimensional embedding",
        "top_embedding_dimension": 497,
        "importance": 3.963246344240615
    },
    "explainability": {
        "gradcam_ed": "/home/vasanth/projects/cardiac_vr_project/outputs/heatmaps/0X482BB41895F1974D_ed.png",
        "gradcam_es": "/home/vasanth/projects/cardiac_vr_project/outputs/heatmaps/0X482BB41895F1974D_es.png"
    },
    "metadata": {
        "fusion_type": "Late Fusion",
        "echo_dataset": "EchoNet-Dynamic",
        "ecg_dataset": "PTB-XL / MIT-BIH",
        "intern": "Intern 2"
    }
}