{
    "patient_id": "0X2DB1613A3E1C52F3",
    "prediction": {
        "base_score": 0.5701806545257568,
        "class": 2,
        "class_label": "Severe",
        "softmax": [
            0.213176429271698,
            0.21664288640022278,
            0.5701806545257568
        ]
    },
    "echo": {
        "predicted_ef": 21.84794044494629,
        "ground_truth_ef": 27.65241829
    },
    "ecg": {
        "representation": "512-dimensional embedding",
        "top_embedding_dimension": 497,
        "importance": 3.963246344240615
    },
    "explainability": {
        "gradcam_ed": "/home/vasanth/projects/cardiac_vr_project/outputs/heatmaps/0X2DB1613A3E1C52F3_ed.png",
        "gradcam_es": "/home/vasanth/projects/cardiac_vr_project/outputs/heatmaps/0X2DB1613A3E1C52F3_es.png"
    },
    "metadata": {
        "fusion_type": "Late Fusion",
        "echo_dataset": "EchoNet-Dynamic",
        "ecg_dataset": "PTB-XL / MIT-BIH",
        "intern": "Intern 2"
    }
}