{
    "patient_id": "0X59A388EB10F25B7D",
    "prediction": {
        "base_score": 0.5408480763435364,
        "class": 0,
        "class_label": "Normal",
        "softmax": [
            0.5408480763435364,
            0.24042820930480957,
            0.21872374415397644
        ]
    },
    "echo": {
        "predicted_ef": 62.135528564453125,
        "ground_truth_ef": 58.06083948
    },
    "ecg": {
        "representation": "512-dimensional embedding",
        "top_embedding_dimension": 497,
        "importance": 3.963246344240615
    },
    "explainability": {
        "gradcam_ed": "/home/vasanth/projects/cardiac_vr_project/outputs/heatmaps/0X59A388EB10F25B7D_ed.png",
        "gradcam_es": "/home/vasanth/projects/cardiac_vr_project/outputs/heatmaps/0X59A388EB10F25B7D_es.png"
    },
    "metadata": {
        "fusion_type": "Late Fusion",
        "echo_dataset": "EchoNet-Dynamic",
        "ecg_dataset": "PTB-XL / MIT-BIH",
        "intern": "Intern 2"
    }
}