{
    "patient_id": "0X14F0C15097590562",
    "prediction": {
        "base_score": 0.5519475936889648,
        "class": 0,
        "class_label": "Normal",
        "softmax": [
            0.5519475936889648,
            0.23132352530956268,
            0.2167288362979889
        ]
    },
    "echo": {
        "predicted_ef": 63.86308670043945,
        "ground_truth_ef": 61.90310698
    },
    "ecg": {
        "representation": "512-dimensional embedding",
        "top_embedding_dimension": 497,
        "importance": 3.963246344240615
    },
    "explainability": {
        "gradcam_ed": "/home/vasanth/projects/cardiac_vr_project/outputs/heatmaps/0X14F0C15097590562_ed.png",
        "gradcam_es": "/home/vasanth/projects/cardiac_vr_project/outputs/heatmaps/0X14F0C15097590562_es.png"
    },
    "metadata": {
        "fusion_type": "Late Fusion",
        "echo_dataset": "EchoNet-Dynamic",
        "ecg_dataset": "PTB-XL / MIT-BIH",
        "intern": "Intern 2"
    }
}