{
    "patient_id": "0X26B209C0083A4AD5",
    "prediction": {
        "base_score": 0.4754282832145691,
        "class": 0,
        "class_label": "Normal",
        "softmax": [
            0.4754282832145691,
            0.2966815233230591,
            0.22789014875888824
        ]
    },
    "echo": {
        "predicted_ef": 56.87113952636719,
        "ground_truth_ef": 49.75004173
    },
    "ecg": {
        "representation": "512-dimensional embedding",
        "top_embedding_dimension": 202,
        "importance": 0.03193804368604712
    },
    "explainability": {
        "gradcam_ed": "/home/vasanth/projects/cardiac_vr_project/outputs/heatmaps/0X26B209C0083A4AD5_ed.png",
        "gradcam_es": "/home/vasanth/projects/cardiac_vr_project/outputs/heatmaps/0X26B209C0083A4AD5_es.png"
    },
    "metadata": {
        "fusion_type": "Late Fusion",
        "echo_dataset": "EchoNet-Dynamic",
        "ecg_dataset": "PTB-XL / MIT-BIH",
        "intern": "Intern 2"
    }
}