{
    "patient_id": "0X558A2A6676BE7D36",
    "prediction": {
        "base_score": 0.5544294714927673,
        "class": 0,
        "class_label": "Normal",
        "softmax": [
            0.5544294714927673,
            0.229305237531662,
            0.21626530587673187
        ]
    },
    "echo": {
        "predicted_ef": 64.3504867553711,
        "ground_truth_ef": 60.78084325
    },
    "ecg": {
        "representation": "512-dimensional embedding",
        "top_embedding_dimension": 202,
        "importance": 0.03193804368604712
    },
    "explainability": {
        "gradcam_ed": "/home/vasanth/projects/cardiac_vr_project/outputs/heatmaps/0X558A2A6676BE7D36_ed.png",
        "gradcam_es": "/home/vasanth/projects/cardiac_vr_project/outputs/heatmaps/0X558A2A6676BE7D36_es.png"
    },
    "metadata": {
        "fusion_type": "Late Fusion",
        "echo_dataset": "EchoNet-Dynamic",
        "ecg_dataset": "PTB-XL / MIT-BIH",
        "intern": "Intern 2"
    }
}