{
    "patient_id": "0X79137B32737A8141",
    "prediction": {
        "base_score": 0.5601807832717896,
        "class": 0,
        "class_label": "Normal",
        "softmax": [
            0.5601807832717896,
            0.2246527373790741,
            0.21516647934913635
        ]
    },
    "echo": {
        "predicted_ef": 65.72257995605469,
        "ground_truth_ef": 65.09822891
    },
    "ecg": {
        "representation": "512-dimensional embedding",
        "top_embedding_dimension": 202,
        "importance": 0.03193804368604712
    },
    "explainability": {
        "gradcam_ed": "/home/vasanth/projects/cardiac_vr_project/outputs/heatmaps/0X79137B32737A8141_ed.png",
        "gradcam_es": "/home/vasanth/projects/cardiac_vr_project/outputs/heatmaps/0X79137B32737A8141_es.png"
    },
    "metadata": {
        "fusion_type": "Late Fusion",
        "echo_dataset": "EchoNet-Dynamic",
        "ecg_dataset": "PTB-XL / MIT-BIH",
        "intern": "Intern 2"
    }
}