{
    "patient_id": "0X47EDDE2F8004F754",
    "prediction": {
        "base_score": 0.42982152104377747,
        "class": 0,
        "class_label": "Normal",
        "softmax": [
            0.42982152104377747,
            0.3385256230831146,
            0.23165296018123627
        ]
    },
    "echo": {
        "predicted_ef": 54.57941818237305,
        "ground_truth_ef": 43.38665358
    },
    "ecg": {
        "representation": "512-dimensional embedding",
        "top_embedding_dimension": 497,
        "importance": 3.963246344240615
    },
    "explainability": {
        "gradcam_ed": "/home/vasanth/projects/cardiac_vr_project/outputs/heatmaps/0X47EDDE2F8004F754_ed.png",
        "gradcam_es": "/home/vasanth/projects/cardiac_vr_project/outputs/heatmaps/0X47EDDE2F8004F754_es.png"
    },
    "metadata": {
        "fusion_type": "Late Fusion",
        "echo_dataset": "EchoNet-Dynamic",
        "ecg_dataset": "PTB-XL / MIT-BIH",
        "intern": "Intern 2"
    }
}