{
    "patient_id": "0X25D1BFBDD75BFAAE",
    "prediction": {
        "base_score": 0.5230890512466431,
        "class": 0,
        "class_label": "Normal",
        "softmax": [
            0.5230890512466431,
            0.2552609145641327,
            0.22164997458457947
        ]
    },
    "echo": {
        "predicted_ef": 60.201175689697266,
        "ground_truth_ef": 68.42943083
    },
    "ecg": {
        "representation": "512-dimensional embedding",
        "top_embedding_dimension": 497,
        "importance": 3.963246344240615
    },
    "explainability": {
        "gradcam_ed": "/home/vasanth/projects/cardiac_vr_project/outputs/heatmaps/0X25D1BFBDD75BFAAE_ed.png",
        "gradcam_es": "/home/vasanth/projects/cardiac_vr_project/outputs/heatmaps/0X25D1BFBDD75BFAAE_es.png"
    },
    "metadata": {
        "fusion_type": "Late Fusion",
        "echo_dataset": "EchoNet-Dynamic",
        "ecg_dataset": "PTB-XL / MIT-BIH",
        "intern": "Intern 2"
    }
}