{
    "patient_id": "0X63CC93D7D9696690",
    "prediction": {
        "base_score": 0.5273816585540771,
        "class": 0,
        "class_label": "Normal",
        "softmax": [
            0.5273816585540771,
            0.2516457140445709,
            0.22097256779670715
        ]
    },
    "echo": {
        "predicted_ef": 60.609519958496094,
        "ground_truth_ef": 64.26519735
    },
    "ecg": {
        "representation": "512-dimensional embedding",
        "top_embedding_dimension": 497,
        "importance": 3.963246344240615
    },
    "explainability": {
        "gradcam_ed": "/home/vasanth/projects/cardiac_vr_project/outputs/heatmaps/0X63CC93D7D9696690_ed.png",
        "gradcam_es": "/home/vasanth/projects/cardiac_vr_project/outputs/heatmaps/0X63CC93D7D9696690_es.png"
    },
    "metadata": {
        "fusion_type": "Late Fusion",
        "echo_dataset": "EchoNet-Dynamic",
        "ecg_dataset": "PTB-XL / MIT-BIH",
        "intern": "Intern 2"
    }
}