{
    "patient_id": "0X47847D0C76E816E7",
    "prediction": {
        "base_score": 0.5126467943191528,
        "class": 0,
        "class_label": "Normal",
        "softmax": [
            0.5126467943191528,
            0.26413485407829285,
            0.22321829199790955
        ]
    },
    "echo": {
        "predicted_ef": 59.31365203857422,
        "ground_truth_ef": 61.39112147
    },
    "ecg": {
        "representation": "512-dimensional embedding",
        "top_embedding_dimension": 202,
        "importance": 0.03193804368604712
    },
    "explainability": {
        "gradcam_ed": "/home/vasanth/projects/cardiac_vr_project/outputs/heatmaps/0X47847D0C76E816E7_ed.png",
        "gradcam_es": "/home/vasanth/projects/cardiac_vr_project/outputs/heatmaps/0X47847D0C76E816E7_es.png"
    },
    "metadata": {
        "fusion_type": "Late Fusion",
        "echo_dataset": "EchoNet-Dynamic",
        "ecg_dataset": "PTB-XL / MIT-BIH",
        "intern": "Intern 2"
    }
}