{
    "patient_id": "0X1FBB4B04FD21CFFD",
    "prediction": {
        "base_score": 0.493918776512146,
        "class": 0,
        "class_label": "Normal",
        "softmax": [
            0.493918776512146,
            0.2803327739238739,
            0.2257484793663025
        ]
    },
    "echo": {
        "predicted_ef": 57.98125457763672,
        "ground_truth_ef": 56.90930626
    },
    "ecg": {
        "representation": "512-dimensional embedding",
        "top_embedding_dimension": 497,
        "importance": 3.963246344240615
    },
    "explainability": {
        "gradcam_ed": "/home/vasanth/projects/cardiac_vr_project/outputs/heatmaps/0X1FBB4B04FD21CFFD_ed.png",
        "gradcam_es": "/home/vasanth/projects/cardiac_vr_project/outputs/heatmaps/0X1FBB4B04FD21CFFD_es.png"
    },
    "metadata": {
        "fusion_type": "Late Fusion",
        "echo_dataset": "EchoNet-Dynamic",
        "ecg_dataset": "PTB-XL / MIT-BIH",
        "intern": "Intern 2"
    }
}