{
    "patient_id": "0X48AEC7223D38243F",
    "prediction": {
        "base_score": 0.5001778602600098,
        "class": 1,
        "class_label": "Mild",
        "softmax": [
            0.26888343691825867,
            0.5001778602600098,
            0.23093865811824799
        ]
    },
    "echo": {
        "predicted_ef": 46.07900619506836,
        "ground_truth_ef": 30.36282215
    },
    "ecg": {
        "representation": "512-dimensional embedding",
        "top_embedding_dimension": 202,
        "importance": 0.03193804368604712
    },
    "explainability": {
        "gradcam_ed": "/home/vasanth/projects/cardiac_vr_project/outputs/heatmaps/0X48AEC7223D38243F_ed.png",
        "gradcam_es": "/home/vasanth/projects/cardiac_vr_project/outputs/heatmaps/0X48AEC7223D38243F_es.png"
    },
    "metadata": {
        "fusion_type": "Late Fusion",
        "echo_dataset": "EchoNet-Dynamic",
        "ecg_dataset": "PTB-XL / MIT-BIH",
        "intern": "Intern 2"
    }
}