{
    "patient_id": "0X39430B9C27CAE73E",
    "prediction": {
        "base_score": 0.5145467519760132,
        "class": 0,
        "class_label": "Normal",
        "softmax": [
            0.5145467519760132,
            0.2625119388103485,
            0.2229413390159607
        ]
    },
    "echo": {
        "predicted_ef": 59.46562576293945,
        "ground_truth_ef": 57.03791036
    },
    "ecg": {
        "representation": "512-dimensional embedding",
        "top_embedding_dimension": 497,
        "importance": 3.963246344240615
    },
    "explainability": {
        "gradcam_ed": "/home/vasanth/projects/cardiac_vr_project/outputs/heatmaps/0X39430B9C27CAE73E_ed.png",
        "gradcam_es": "/home/vasanth/projects/cardiac_vr_project/outputs/heatmaps/0X39430B9C27CAE73E_es.png"
    },
    "metadata": {
        "fusion_type": "Late Fusion",
        "echo_dataset": "EchoNet-Dynamic",
        "ecg_dataset": "PTB-XL / MIT-BIH",
        "intern": "Intern 2"
    }
}