{
    "patient_id": "0X175303C2D48B91CA",
    "prediction": {
        "base_score": 0.44584178924560547,
        "class": 0,
        "class_label": "Normal",
        "softmax": [
            0.44584178924560547,
            0.3235800266265869,
            0.23057821393013
        ]
    },
    "echo": {
        "predicted_ef": 55.33677673339844,
        "ground_truth_ef": 57.60717332
    },
    "ecg": {
        "representation": "512-dimensional embedding",
        "top_embedding_dimension": 497,
        "importance": 3.963246344240615
    },
    "explainability": {
        "gradcam_ed": "/home/vasanth/projects/cardiac_vr_project/outputs/heatmaps/0X175303C2D48B91CA_ed.png",
        "gradcam_es": "/home/vasanth/projects/cardiac_vr_project/outputs/heatmaps/0X175303C2D48B91CA_es.png"
    },
    "metadata": {
        "fusion_type": "Late Fusion",
        "echo_dataset": "EchoNet-Dynamic",
        "ecg_dataset": "PTB-XL / MIT-BIH",
        "intern": "Intern 2"
    }
}