{
    "patient_id": "0X76571CA78B208B80",
    "prediction": {
        "base_score": 0.5190220475196838,
        "class": 0,
        "class_label": "Normal",
        "softmax": [
            0.5190220475196838,
            0.25870373845100403,
            0.22227422893047333
        ]
    },
    "echo": {
        "predicted_ef": 59.83949661254883,
        "ground_truth_ef": 64.39864489
    },
    "ecg": {
        "representation": "512-dimensional embedding",
        "top_embedding_dimension": 497,
        "importance": 3.963246344240615
    },
    "explainability": {
        "gradcam_ed": "/home/vasanth/projects/cardiac_vr_project/outputs/heatmaps/0X76571CA78B208B80_ed.png",
        "gradcam_es": "/home/vasanth/projects/cardiac_vr_project/outputs/heatmaps/0X76571CA78B208B80_es.png"
    },
    "metadata": {
        "fusion_type": "Late Fusion",
        "echo_dataset": "EchoNet-Dynamic",
        "ecg_dataset": "PTB-XL / MIT-BIH",
        "intern": "Intern 2"
    }
}